{
  "schemaVersion": 1,
  "issue": 18,
  "status": "PROPOSED",
  "acquisitionStatus": "PREPARED_NOT_ORDERED",
  "captureDate": "2026-09-01",
  "currency": "USD",
  "sourcePolicy": {
    "manufacturer": "Authoritative for identity, electrical limits, package and operating instructions.",
    "distributor": "Dated availability and price snapshots only; re-check before any owner-approved purchase.",
    "price": "Every numeric price is a 2026-09-01 snapshot or a range derived from that snapshot; tax, freight and regional currency are excluded.",
    "orderAction": "This pack prepares an owner checklist only. It places no order, opens no cart, and makes no vendor contact."
  },
  "boundary": {
    "isolatedLowVoltageOnly": true,
    "usbC": false,
    "pd": false,
    "vbus": false,
    "thunderbolt": false,
    "highSpeed": false,
    "targetMacBooks": false,
    "dock": false,
    "productPowerDomain": false,
    "valuableEquipment": false,
    "maximumBenchVoltageVolts": 5.5,
    "maximumBenchSupplyCurrentMilliamp": 250,
    "simultaneousUsbAndVsys": false,
    "documentedOringRequiredForSimultaneous": true
  },
  "power": {
    "recommendedSupplySetVolts": 3.3,
    "initialCurrentLimitMilliamp": 100,
    "hardCurrentLimitMilliamp": 250,
    "connection": "Supply positive to Pico 2 VSYS, supply return to Pico 2 GND; never connect supply positive to VBUS or micro-USB.",
    "workflow": [
      "program-over-Pico-micro-USB",
      "disconnect-USB-at-both-ends",
      "verify-disconnected-USB-VBUS-is-0V-with-DMM",
      "set-current-limited-supply-to-3.3V-and-100mA",
      "connect-only-VSYS-and-GND",
      "increase-limit-no-higher-than-250mA-if-needed",
      "test-and-log"
    ],
    "stopConditions": [
      "Any voltage appears on the disconnected micro-USB VBUS pin.",
      "The supply enters current limit during a no-load or normal-idle test.",
      "Any cable, probe ground, display pin or UART VCC creates an unreviewed second power path.",
      "VSYS exceeds 5.5V or any GPIO exceeds the local 0-3.3V logic boundary."
    ]
  },
  "measurementRanges": {
    "vsysDmmVolts": {
      "min": 0,
      "max": 5.5,
      "unit": "V DC",
      "procedure": "Measure VSYS-to-GND before attaching the Pico; use the DMM 6V DC range when available."
    },
    "gpioLogicVolts": {
      "min": 0,
      "max": 3.3,
      "unit": "V DC",
      "procedure": "Probe GP2/GP3/GP6/GP7/GP8 only relative to local GND."
    },
    "adcPinVolts": {
      "min": 0,
      "max": 3.3,
      "unit": "V DC",
      "procedure": "Never drive GP26 above ADC_VREF; the external divider maps 0-5.5V VSYS to at most 2.89V with the specified 5% resistors."
    },
    "serial": {
      "logic": "3.3V",
      "baud": 115200,
      "format": "8N1",
      "unit": "UART"
    },
    "scope": {
      "min": 0,
      "max": 5.5,
      "unit": "V DC",
      "procedure": "Use 1x/10x probe only on local low-voltage nodes; no mains or product rails."
    },
    "continuityAndResistance": {
      "min": 0,
      "max": 200000,
      "unit": "ohm",
      "procedure": "De-energize and disconnect USB before resistance or continuity checks."
    }
  },
  "evidenceCapture": {
    "usbPoweredSetup": "Use the Pico micro-USB and FTDI logger only for programming, normal button/UI cases and reset-cause serial logs. FTDI VCC remains physically disconnected.",
    "directVsysCases": "For B9/B10 brownout and power-loss cases, unplug Pico USB and the FTDI USB cable at both ends. Capture the direct-VSYS voltage/current waveform and supply record with DMM/scope. If a reset-cause log is needed, run the identical scripted case separately in the USB-powered setup and label it USB-powered; never present it as direct-VSYS evidence.",
    "requiredSeparation": "Serial logs and direct-VSYS waveforms are separate sequential evidence. No USB VBUS, UART VCC, display power or instrument lead may create a second source during direct-VSYS tests."
  },
  "items": [
    {
      "id": "pico2-board",
      "category": "controller",
      "role": "Recommended controller for the isolated bench",
      "requiredness": "REQUIRED",
      "ownerLikelyHas": false,
      "buyAction": "BUY_IF_MISSING",
      "manufacturer": "Raspberry Pi",
      "mpn": "SC1631",
      "orderCode": "SC1631",
      "quantity": 1,
      "specification": "Pico 2, RP2350A, 3.3V GPIO, 26 multifunction GPIO, 1.8-5.5V VSYS, micro-USB only for programming/logical setup",
      "manufacturerSource": {
        "url": "https://datasheets.raspberrypi.com/pico/pico-2-datasheet.pdf",
        "accessedDate": "2026-09-01",
        "claims": [
          "SC1631 order code",
          "VSYS 1.8-5.5V",
          "3.3V GPIO",
          "3V3 external load recommended below 300mA",
          "on-board VBUS-to-VSYS diode and separate VSYS input"
        ]
      },
      "distributorSnapshots": [
        {
          "vendor": "DigiKey",
          "url": "https://www.digikey.com/en/products/detail/raspberry-pi/SC1631/24627142",
          "accessedDate": "2026-09-01",
          "stock": "23618 shown",
          "unitPriceUsd": { "min": 6.12, "max": 6.12 },
          "distributorPartNumber": "2648-SC1631CT-ND",
          "notes": "Cut tape snapshot; verify board form and exact SC1631 before purchase."
        }
      ],
      "substitutions": [
        {
          "manufacturer": "Raspberry Pi",
          "mpn": "SC1632",
          "orderCode": "SC1632",
          "quantity": 1,
          "constraint": "Same Pico 2 hardware with factory-soldered headers; accept the higher price and use only if the owner prefers headers.",
          "sourceUrl": "https://pip.raspberrypi.com/categories/1264-raspberry-pi-pico-2-h"
        }
      ]
    },
    {
      "id": "breadboard",
      "category": "mechanical",
      "role": "Solderless isolated build surface",
      "requiredness": "REQUIRED",
      "ownerLikelyHas": true,
      "buyAction": "CHECK_OWN_STOCK_THEN_BUY_IF_MISSING",
      "manufacturer": "BusBoard Prototype Systems",
      "mpn": "BB830",
      "orderCode": "BB830",
      "quantity": 1,
      "specification": "830 tie points, four power rails, 21-26 AWG wire, 36V/2A board rating; use only at 3.3V and <=250mA here",
      "manufacturerSource": {
        "url": "https://www.busboard.com/BB830",
        "accessedDate": "2026-09-01",
        "claims": [
          "830 tie points",
          "four power rails",
          "21-26 AWG",
          "36V/2A rating"
        ]
      },
      "distributorSnapshots": [
        {
          "vendor": "DigiKey",
          "url": "https://www.digikey.com/en/products/detail/busboard-prototype-systems/BB830/19200392",
          "accessedDate": "2026-09-01",
          "stock": "1386 shown",
          "unitPriceUsd": { "min": 8.95, "max": 8.95 },
          "distributorPartNumber": "4526-BB830-ND"
        }
      ],
      "substitutions": [
        {
          "manufacturer": "BusBoard Prototype Systems",
          "mpn": "BB400",
          "orderCode": "BB400",
          "quantity": 1,
          "constraint": "Only if the layout still leaves a visibly separated power and signal area; do not substitute a solderless board with unknown contacts.",
          "sourceUrl": "https://www.busboard.com/BB400"
        }
      ]
    },
    {
      "id": "local-button",
      "category": "input",
      "role": "Local momentary button",
      "requiredness": "REQUIRED",
      "ownerLikelyHas": true,
      "buyAction": "CHECK_OWN_STOCK_THEN_BUY_IF_MISSING",
      "manufacturer": "Omron (listed by DigiKey as Aratas formerly Omron Components)",
      "mpn": "B3F-1000",
      "orderCode": "B3F-1000",
      "quantity": 1,
      "specification": "Through-hole SPST-NO, 4.3mm actuator, 100gf, 0.05A at 24VDC, 1,000,000 cycles; use as a dry contact to GND",
      "manufacturerSource": {
        "url": "https://components.omron.com/us-en/asset/ds_related_pdf/Y234-E1.pdf",
        "accessedDate": "2026-09-01",
        "claims": [
          "B3F-1000 through-hole model",
          "SPST-NO",
          "0.05A at 24VDC",
          "1,000,000 operations"
        ]
      },
      "distributorSnapshots": [
        {
          "vendor": "DigiKey",
          "url": "https://www.digikey.com/en/products/detail/aratas-formerly-omron-components/B3F-1000/33150",
          "accessedDate": "2026-09-01",
          "stock": "43967 shown",
          "unitPriceUsd": { "min": 0.35, "max": 0.35 },
          "distributorPartNumber": "SW400-ND"
        }
      ],
      "substitutions": [
        {
          "manufacturer": "C&K",
          "mpn": "PTS645SL43SMTR92 LFS",
          "orderCode": "PTS645SL43SMTR92 LFS",
          "quantity": 1,
          "constraint": "Surface-mount substitute only for an owner able to solder it; not the beginner default.",
          "sourceUrl": "https://www.digikey.com/en/products/detail/c-k/PTS645SL43SMTR92-LFS/3861373"
        }
      ]
    },
    {
      "id": "remote-button",
      "category": "input",
      "role": "Optional request-only remote button; no output authority or power returned",
      "requiredness": "REQUIRED_FOR_B5_B7",
      "ownerLikelyHas": true,
      "buyAction": "CHECK_OWN_STOCK_THEN_BUY_IF_MISSING",
      "manufacturer": "Omron (listed by DigiKey as Aratas formerly Omron Components)",
      "mpn": "B3F-1000",
      "orderCode": "B3F-1000",
      "quantity": 1,
      "specification": "Same dry-contact switch as local input; install on a short insulated two-wire lead no longer than 300mm",
      "manufacturerSource": {
        "url": "https://components.omron.com/us-en/asset/ds_related_pdf/Y234-E1.pdf",
        "accessedDate": "2026-09-01",
        "claims": ["B3F-1000 contact rating and through-hole form"]
      },
      "distributorSnapshots": [
        {
          "vendor": "DigiKey",
          "url": "https://www.digikey.com/en/products/detail/aratas-formerly-omron-components/B3F-1000/33150",
          "accessedDate": "2026-09-01",
          "stock": "43967 shown",